{
  "id": "KOL-PATH-0015",
  "title": "blk-mq: масштабирование очередей не гарантирует ordering",
  "subsystem": "Block I/O",
  "category": [
    "PERFORMANCE",
    "ARCHITECTURAL_DEBT"
  ],
  "linux_versions": "blk-mq documentation связывает redesign с SSD/high IOPS и contention старой single queue.",
  "first_known_version": null,
  "status": "ANALYZED_WITH_OPEN_QUESTIONS",
  "research_date": "2026-10-02",
  "sources": [
    {
      "id": "S15",
      "title": "blk-mq",
      "url": "https://docs.kernel.org/block/blk-mq.html",
      "repository": "https://git.kernel.org/pub/scm/linux/kernel/git/torvalds/linux.git",
      "commit": null,
      "tag_version": null,
      "date": null,
      "research_date": "2026-10-02",
      "locator": "Introduction; software and hardware queues; ordering",
      "kind": "OFFICIAL_DOCUMENTATION",
      "provenance_limitations": "Прочитана указанная web-страница. Неуказанные commit, версия документа или дата публикации не подтверждены; null не означает отсутствие истории. Дата исследования не является датой изменения Linux.",
      "subsystem": "Block I/O"
    }
  ],
  "historical_context": "blk-mq documentation связывает redesign с SSD/high IOPS и contention старой single queue.",
  "original_reason": "Одна очередь и lock были проще для медленных устройств.",
  "root_cause": "Глобальная сериализация плохо масштабируется с CPU и hardware queues.",
  "observable_behavior": "blk-mq использует software staging queues и hardware dispatch queues; порядок completion не гарантируется.",
  "compatibility_dependency": "Consumers не должны подменять flush/durability предположением о порядке submit.",
  "security_impact": "Ошибка ordering может потерять данные.",
  "performance_impact": "Multiqueue полезна не для всех нагрузок.",
  "complexity_impact": "Queue count не должен становиться ABI.",
  "hardware_dependency": "NVMe/VirtIO и число hardware queues.",
  "linux_current_solution": "Linux предоставляет multiqueue design; ordering должен обеспечиваться соответствующими слоями.",
  "remaining_problem": "Нужна ли сложная multiqueue реализация первому VirtIO target или достаточно минимального backend?",
  "constraints_then": "Медленные диски, меньше concurrency.",
  "constraints_now": "Многоядерность остаётся, но KOLVRT сначала измеряет собственные workloads.",
  "change_consequences": "Consumers не должны подменять flush/durability предположением о порядке submit.",
  "improvement_assessment": "Вывод KOLVRT: Block requests имеют ID, completion и явные ordering/durability dependencies; topology очередей скрыта за contract. Это проектный выбор; превосходство по производительности не измерено.",
  "kolvrt_decision": "ACCEPTED_TRADEOFF",
  "kolvrt_native_semantics": "Block requests имеют ID, completion и явные ordering/durability dependencies; topology очередей скрыта за contract.",
  "compatibility_required": "NO",
  "compatibility_scope": "NONE",
  "migration_strategy": "Драйверы не получают обещания FIFO completion; зависимый I/O задаёт явный barrier.",
  "tests_required": [
    "Out-of-order completions сохраняют request ownership.",
    "Flush dependency и device failure не дают ложный durable success."
  ],
  "benchmarks_required": [
    "1..N CPU, queue depths и mixed reads/writes: IOPS, p99, fairness, contention."
  ],
  "confidence": "MEDIUM",
  "open_questions": [
    "Нужна ли сложная multiqueue реализация первому VirtIO target или достаточно минимального backend?",
    "Установить первый introducing commit/tag по git history; прочитанный источник подтверждает механизм, но не его точную дату появления."
  ],
  "evidence": {
    "historical_context": [
      "S15"
    ],
    "original_reason": [
      "S15"
    ],
    "root_cause": [
      "S15"
    ],
    "observable_behavior": [
      "S15"
    ],
    "compatibility_dependency": [
      "S15"
    ],
    "linux_current_solution": [
      "S15"
    ]
  }
}
