{
  "id": "KOL-PATH-0014",
  "title": "USB persist: descriptors не доказывают идентичность",
  "subsystem": "USB / suspend",
  "category": ["HARDWARE_QUIRK", "RESOURCE_MANAGEMENT"],
  "linux_versions": "Документ датирован 2006-09-02, обновлён 2008-02-25; описывает потерю power session при suspend.",
  "first_known_version": null,
  "status": "ANALYZED_WITH_OPEN_QUESTIONS",
  "research_date": "2026-10-02",
  "sources": [
    {
      "id": "S14",
      "title": "USB persistence",
      "url": "https://docs.kernel.org/driver-api/usb/persist.html",
      "repository": "https://git.kernel.org/pub/scm/linux/kernel/git/torvalds/linux.git",
      "commit": null,
      "tag_version": null,
      "date": "2008-02-25",
      "research_date": "2026-10-02",
      "locator": "Problem; solution; warnings",
      "kind": "OFFICIAL_DOCUMENTATION",
      "provenance_limitations": "Прочитана указанная web-страница. Неуказанные commit, версия документа или дата публикации не подтверждены; null не означает отсутствие истории. Дата исследования не является датой изменения Linux.",
      "subsystem": "USB / suspend"
    }
  ],
  "historical_context": "Документ датирован 2006-09-02, обновлён 2008-02-25; описывает потерю power session при suspend.",
  "original_reason": "Обычный disconnect ломал mounted storage после firmware reset controller.",
  "root_cause": "После power loss невозможно гарантировать, что подключено то же устройство.",
  "observable_behavior": "USB-persist переиспользует device structure после reset/re-enumeration при совпадении descriptors.",
  "compatibility_dependency": "Строгий disconnect безопаснее для identity, но может разрушить рабочий сценарий USB root filesystem.",
  "security_impact": "Identity confusion и риск порчи данных.",
  "performance_impact": "Conservative recovery может быть медленнее.",
  "complexity_impact": "Mount recovery пересекает USB/VFS boundary.",
  "hardware_dependency": "USB power loss, firmware reset.",
  "linux_current_solution": "Linux предоставляет per-device persistence и описывает риски одинаковых descriptors.",
  "remaining_problem": "Есть ли приемлемое подтверждение identity для устройств без криптографической идентификации?",
  "constraints_then": "Нельзя исправить firmware и опознать device после power loss.",
  "constraints_now": "Ограничение остаётся; convenience не равна доказанной identity.",
  "change_consequences": "Строгий disconnect безопаснее для identity, но может разрушить рабочий сценарий USB root filesystem.",
  "improvement_assessment": "Вывод KOLVRT: По умолчанию потеря session отзывает device generation; сохранение storage identity требует отдельного доказанного recovery protocol. Это проектный выбор; превосходство по производительности не измерено.",
  "kolvrt_decision": "RESEARCH_REQUIRED",
  "kolvrt_native_semantics": "По умолчанию потеря session отзывает device generation; сохранение storage identity требует отдельного доказанного recovery protocol.",
  "compatibility_required": "CONDITIONAL",
  "compatibility_scope": "usb.persistence/v1, конкретное device и mount recovery domain",
  "migration_strategy": "Не переносить открытые I/O handles на переопределённый device без drain и identity check.",
  "tests_required": [
    "Подмена устройства с одинаковыми VID/PID/descriptors не получает старые handles.",
    "Suspend с pending writes: результат ошибки и recovery детерминирован."
  ],
  "benchmarks_required": [
    "Resume latency против conservative disconnect; стоимость recovery и loss accounting."
  ],
  "confidence": "MEDIUM",
  "open_questions": [
    "Есть ли приемлемое подтверждение identity для устройств без криптографической идентификации?",
    "Установить первый introducing commit/tag по git history; прочитанный источник подтверждает механизм, но не его точную дату появления."
  ],
  "evidence": {
    "historical_context": ["S14"],
    "original_reason": ["S14"],
    "root_cause": ["S14"],
    "observable_behavior": ["S14"],
    "compatibility_dependency": ["S14"],
    "linux_current_solution": ["S14"]
  }
}
