{
  "id": "KOL-PATH-0030",
  "title": "epoll fix regression: нельзя воскресить dying file",
  "subsystem": "VFS / eventpoll / fuzzing",
  "category": [
    "MEMORY_SAFETY",
    "CONCURRENCY",
    "REGRESSION"
  ],
  "linux_versions": "syzbot cause bisection указывает a9ed4a6560b8562b7e2e2bed9527e88001f7b682 от 2020-08-19; fix 77f4689de17c.",
  "first_known_version": null,
  "status": "ANALYZED_WITH_OPEN_QUESTIONS",
  "research_date": "2026-10-02",
  "sources": [
    {
      "id": "S29",
      "title": "epoll regression fix",
      "url": "https://github.com/torvalds/linux/commit/77f4689de17c",
      "repository": "https://git.kernel.org/pub/scm/linux/kernel/git/torvalds/linux.git",
      "commit": "77f4689de17c",
      "tag_version": null,
      "date": null,
      "research_date": "2026-10-02",
      "locator": "Commit message; get_file_rcu diff",
      "kind": "COMMIT",
      "provenance_limitations": "Прочитана указанная web-страница. Неуказанные commit, версия документа или дата публикации не подтверждены; null не означает отсутствие истории. Дата исследования не является датой изменения Linux.",
      "subsystem": "VFS / eventpoll / fuzzing"
    },
    {
      "id": "S30",
      "title": "syzbot: general protection fault in sock_close",
      "url": "https://syzkaller.appspot.com/bug?extid=e24baf53dc389927a7c3",
      "repository": "https://github.com/google/syzkaller",
      "commit": null,
      "tag_version": null,
      "date": null,
      "research_date": "2026-10-02",
      "locator": "Fix commit; cause bisection; no-op fix bisection; reproducer",
      "kind": "BUG_REPORT",
      "provenance_limitations": "Прочитана указанная web-страница. Неуказанные commit, версия документа или дата публикации не подтверждены; null не означает отсутствие истории. Дата исследования не является датой изменения Linux.",
      "subsystem": "VFS / eventpoll / fuzzing"
    },
    {
      "id": "S31",
      "title": "syz reproducer for sock_close",
      "url": "https://syzkaller.appspot.com/text?tag=ReproSyz&x=127d3c99900000",
      "repository": "https://github.com/google/syzkaller",
      "commit": null,
      "tag_version": null,
      "date": null,
      "research_date": "2026-10-02",
      "locator": "Nine-line syzkaller program",
      "kind": "REPRODUCER",
      "provenance_limitations": "Прочитана указанная web-страница. Неуказанные commit, версия документа или дата публикации не подтверждены; null не означает отсутствие истории. Дата исследования не является датой изменения Linux.",
      "subsystem": "VFS / eventpoll / fuzzing"
    }
  ],
  "historical_context": "syzbot cause bisection указывает a9ed4a6560b8562b7e2e2bed9527e88001f7b682 от 2020-08-19; fix 77f4689de17c.",
  "original_reason": "Предыдущий fix удерживал files в check list.",
  "root_cause": "Unconditional get_file мог встретить объект, уже переданный destruction.",
  "observable_behavior": "syzbot зафиксировал crash в sock_close; patch делает acquisition условным get_file_rcu.",
  "compatibility_dependency": "API semantics не требуют resurrection dead reference.",
  "security_impact": "Memory lifetime corruption; exploitability здесь не оценивалась.",
  "performance_impact": "Conditional acquisition может повторять lookup.",
  "complexity_impact": "RCU protection не равно strong ownership.",
  "hardware_dependency": "Исходный reproducer target отличается от будущего ARM64.",
  "linux_current_solution": "77f4689de17c добавляет conditional acquisition; dashboard fix-bisect отдельно показывает no-op commit и не считается causal proof.",
  "remaining_problem": "Повторить bisection: dashboard содержит неверифицируемый no-op fix result; LKML thread не удалось прочитать.",
  "constraints_then": "Исправление reference lifetime с concurrency.",
  "constraints_now": "Гонка актуальна для любого refcount/RCU дизайна; Rust wrapper должен доказать upgrade.",
  "change_consequences": "API semantics не требуют resurrection dead reference.",
  "improvement_assessment": "Вывод KOLVRT: Weak-to-strong upgrade атомарно отклоняет retiring object; terminal state нельзя превратить обратно в live. Это проектный выбор; превосходство по производительности не измерено.",
  "kolvrt_decision": "NATIVE_FIX",
  "kolvrt_native_semantics": "Weak-to-strong upgrade атомарно отклоняет retiring object; terminal state нельзя превратить обратно в live.",
  "compatibility_required": "NO",
  "compatibility_scope": "NONE",
  "migration_strategy": "Сохранять reproducer и causal fix вместе; не объявлять исправление по одному исчезнувшему crash.",
  "tests_required": [
    "Model-check lookup/last-drop/upgrade interleavings.",
    "Изолированно replay syz fixture на culprit и fix; не выполнено в Phase 0.1."
  ],
  "benchmarks_required": [
    "Upgrade/retire contention, reclamation memory и p99 при nested wait graphs."
  ],
  "confidence": "MEDIUM",
  "open_questions": [
    "Повторить bisection: dashboard содержит неверифицируемый no-op fix result; LKML thread не удалось прочитать.",
    "Установить первый introducing commit/tag по git history; прочитанный источник подтверждает механизм, но не его точную дату появления."
  ],
  "evidence": {
    "historical_context": [
      "S29",
      "S30",
      "S31"
    ],
    "original_reason": [
      "S29",
      "S30",
      "S31"
    ],
    "root_cause": [
      "S29",
      "S30",
      "S31"
    ],
    "observable_behavior": [
      "S29",
      "S30",
      "S31"
    ],
    "compatibility_dependency": [
      "S29",
      "S30",
      "S31"
    ],
    "linux_current_solution": [
      "S29",
      "S30",
      "S31"
    ]
  }
}
